<?xml version="1.0" encoding="utf-8"?>
<Root xmlns="OrientalEmpires"
xmlns:xsi = "http://www.w3.org/2001/XMLSchema-instance"
       xsi:schemaLocation ="OrientalEmpires Encounters.xsd">

  <!-- Tech Encounters /////////////////////////////////////////////////-->
  <!-- Famous Craftsman -->
  <Encounter ID="CraftsmanA" PersistAfterFirstVisit="10">
    <Graphics Picture="EncounterBG_03" Portrait="Character_07" SpriteMarker="G_Icon_Encounter_Default_01" EventIcon="G_Icon_List_EventEncounter_01"/>
    <Occurance BaseChance="0.0005">
      <AllowedTerrain ID="Fertile Plain"/>
      <AllowedTerrain ID="Grassland"/>
      <ClimateModifier ID="Gobi Desert" Modifier="0"/>
      <ClimateModifier ID="Central Asia" Modifier="0.5"/>
    </Occurance>
    <!-- High random range for reward to span list of techs -->
    <Rewards Type="RandomCraftTech" Min="0" Max="10000"/>
    <Cost Type="Money" Min="50" Max="200"/>
    <Text NoReward="ENC Nothing To Teach"/>
  </Encounter>
  <Encounter ID="CraftsmanB" PersistAfterFirstVisit="10">
    <Graphics Picture="EncounterBG_03" Portrait="Character_16" SpriteMarker="G_Icon_Encounter_Default_01" EventIcon="G_Icon_List_EventEncounter_01"/>
    <Occurance BaseChance="0.0005">
      <AllowedTerrain ID="Fertile Plain"/>
      <AllowedTerrain ID="Grassland"/>
      <ClimateModifier ID="Gobi Desert" Modifier="0"/>
      <ClimateModifier ID="Central Asia" Modifier="0.5"/>
    </Occurance>
    <Rewards Type="ImproveCraftResearch" Min="5" Max="15"/>
    <Cost Type="Money" Min="250" Max="750"/>
    <Text NoReward="ENC Nothing To Teach"/>
  </Encounter>

  <!-- Famous Statesmen -->
  <Encounter ID="StatesmanA" PersistAfterFirstVisit="10">
    <Graphics Picture="EncounterBG_10" Portrait="Character_06" SpriteMarker="G_Icon_Encounter_Default_01" EventIcon="G_Icon_List_EventEncounter_01"/>
    <Occurance BaseChance="0.0005">
      <AllowedTerrain ID="Fertile Plain"/>
      <AllowedTerrain ID="Grassland"/>
      <ClimateModifier ID="Gobi Desert" Modifier="0"/>
      <ClimateModifier ID="Central Asia" Modifier="0.5"/>
    </Occurance>
    <!-- High random range for reward to span list of techs -->
    <Rewards Type="RandomPowerTech" Min="0" Max="10000"/>
    <Cost Type="Money" Min="100" Max="250"/>
    <Text NoReward="ENC Nothing To Teach"/>
  </Encounter>
  <Encounter ID="StatesmanB" PersistAfterFirstVisit="10">
    <Graphics Picture="EncounterBG_11" Portrait="Character_09" SpriteMarker="G_Icon_Encounter_Default_01" EventIcon="G_Icon_List_EventEncounter_01"/>
    <Occurance BaseChance="0.0005">
      <AllowedTerrain ID="Fertile Plain"/>
      <AllowedTerrain ID="Grassland"/>
      <ClimateModifier ID="Gobi Desert" Modifier="0"/>
      <ClimateModifier ID="Central Asia" Modifier="0.5"/>
    </Occurance>
    <Rewards Type="ImprovePowerResearch" Min="5" Max="15"/>
    <Cost Type="Money" Min="300" Max="900"/>
    <Text NoReward="ENC Nothing To Teach"/>
  </Encounter>
  <Encounter ID="StatesmanC" PersistAfterFirstVisit="10">
    <Graphics Picture="EncounterBG_12" Portrait="Character_15" SpriteMarker="G_Icon_Encounter_Default_01" EventIcon="G_Icon_List_EventEncounter_01"/>
    <Occurance BaseChance="0.0005">
      <AllowedTerrain ID="Fertile Plain"/>
      <AllowedTerrain ID="Grassland"/>
      <ClimateModifier ID="Gobi Desert" Modifier="0"/>
      <ClimateModifier ID="Central Asia" Modifier="0.5"/>
    </Occurance>
    <Rewards Type="JoinAsCivilLeader" Min="0" Max="0"/>
    <Cost Type="Money" Min="500" Max="1500"/>
    <Text NoReward="ENC Not Here"/>
  </Encounter>

  <!-- Famous Philosophers -->
  <Encounter ID="PhilosopherA" PersistAfterFirstVisit="10">
    <Graphics Picture="EncounterBG_09" Portrait="Character_01" SpriteMarker="G_Icon_Encounter_Default_01" EventIcon="G_Icon_List_EventEncounter_01"/>
    <Occurance BaseChance="0.0005">
      <AllowedTerrain ID="Fertile Plain"/>
      <AllowedTerrain ID="Grassland"/>
      <AllowedTerrain ID="Gentle Hills"/>
      <ClimateModifier ID="Gobi Desert" Modifier="0.1"/>
      <ClimateModifier ID="Central Asia" Modifier="0.5"/>
    </Occurance>
    <!-- High random range for reward to span list of techs -->
    <Rewards Type="RandomThoughtTech" Min="0" Max="10000"/>
    <Text NoReward="ENC Nothing To Teach"/>
  </Encounter>
  <Encounter ID="PhilosopherB" PersistAfterFirstVisit="10">
    <Graphics Picture="EncounterBG_12" Portrait="Character_12" SpriteMarker="G_Icon_Encounter_Default_01" EventIcon="G_Icon_List_EventEncounter_01"/>
    <Occurance BaseChance="0.0005">
      <AllowedTerrain ID="Fertile Plain"/>
      <AllowedTerrain ID="Grassland"/>
      <AllowedTerrain ID="Gentle Hills"/>
      <ClimateModifier ID="Gobi Desert" Modifier="0.1"/>
      <ClimateModifier ID="Central Asia" Modifier="0.5"/>
    </Occurance>
    <Rewards Type="ImproveThoughtResearch" Min="5" Max="15"/>
    <Cost Type="Money" Min="100" Max="300"/>
    <Text NoReward="ENC Nothing To Teach"/>
  </Encounter>

  <!-- Famous Scholars -->
  <Encounter ID="ScholarA" PersistAfterFirstVisit="10">
    <Graphics Picture="EncounterBG_06" Portrait="Character_13" SpriteMarker="G_Icon_Encounter_Default_01" EventIcon="G_Icon_List_EventEncounter_01"/>
    <Occurance BaseChance="0.0005">
      <AllowedTerrain ID="Fertile Plain"/>
      <AllowedTerrain ID="Grassland"/>
      <ClimateModifier ID="Gobi Desert" Modifier="0"/>
      <ClimateModifier ID="Central Asia" Modifier="0.5"/>
    </Occurance>
    <!-- High random range for reward to span list of techs -->
    <Rewards Type="RandomKnowledgeTech" Min="0" Max="10000"/>
    <Cost Type="Money" Min="200" Max="400"/>
    <Text NoReward="ENC Nothing To Teach"/>
  </Encounter>
  <Encounter ID="ScholarB" PersistAfterFirstVisit="10">
    <Graphics Picture="EncounterBG_04" Portrait="Character_17" SpriteMarker="G_Icon_Encounter_Default_01" EventIcon="G_Icon_List_EventEncounter_01"/>
    <Occurance BaseChance="0.0005">
      <AllowedTerrain ID="Fertile Plain"/>
      <AllowedTerrain ID="Grassland"/>
      <ClimateModifier ID="Gobi Desert" Modifier="0"/>
      <ClimateModifier ID="Central Asia" Modifier="0.5"/>
    </Occurance>
    <Rewards Type="ImproveKnowledgeResearch" Min="5" Max="15"/>
    <Cost Type="Money" Min="250" Max="750"/>
    <Text NoReward="ENC Nothing To Teach"/>
  </Encounter>

  <!-- Teachers -->
  <Encounter ID="TeacherA" PersistAfterFirstVisit="10">
    <Graphics Picture="EncounterBG_01" Portrait="Character_09" SpriteMarker="G_Icon_Encounter_Default_01" EventIcon="G_Icon_List_EventEncounter_01"/>
    <Occurance BaseChance="0.0005">
      <AllowedTerrain ID="Fertile Plain"/>
      <AllowedTerrain ID="Grassland"/>
      <ClimateModifier ID="Gobi Desert" Modifier="0"/>
      <ClimateModifier ID="Central Asia" Modifier="0.5"/>
    </Occurance>
    <Rewards Type="ImproveQi" Min="1" Max="2"/>
    <Cost Type="Money" Min="100" Max="300"/>
    <Text NoReward="ENC Nothing To Teach"/>
  </Encounter>
  <Encounter ID="TeacherB" PersistAfterFirstVisit="10">
    <Graphics Picture="EncounterBG_06" Portrait="Character_06" SpriteMarker="G_Icon_Encounter_Default_01" EventIcon="G_Icon_List_EventEncounter_01"/>
    <Occurance BaseChance="0.0005">
      <AllowedTerrain ID="Fertile Plain"/>
      <AllowedTerrain ID="Grassland"/>
      <ClimateModifier ID="Gobi Desert" Modifier="0"/>
      <ClimateModifier ID="Central Asia" Modifier="0.5"/>
    </Occurance>
    <Rewards Type="ImproveRen" Min="1" Max="2"/>
    <Cost Type="Money" Min="100" Max="300"/>
    <Text NoReward="ENC Nothing To Teach"/>
  </Encounter>
  <Encounter ID="TeacherC" PersistAfterFirstVisit="10">
    <Graphics Picture="EncounterBG_09" Portrait="Character_19" SpriteMarker="G_Icon_Encounter_Default_01" EventIcon="G_Icon_List_EventEncounter_01"/>
    <Occurance BaseChance="0.0005">
      <AllowedTerrain ID="Fertile Plain"/>
      <AllowedTerrain ID="Grassland"/>
      <ClimateModifier ID="Gobi Desert" Modifier="0"/>
      <ClimateModifier ID="Central Asia" Modifier="0.5"/>
    </Occurance>
    <Rewards Type="ImproveRen" Min="1" Max="1"/>
    <Text NoReward="ENC Nothing To Teach"/>
  </Encounter>

  <!-- Historians-->
  <Encounter ID="HistorianA" PersistAfterFirstVisit="10">
    <Graphics Picture="EncounterBG_01" Portrait="Character_10" SpriteMarker="G_Icon_Encounter_Default_01" EventIcon="G_Icon_List_EventEncounter_01"/>
    <Occurance BaseChance="0.0005">
      <AllowedTerrain ID="Fertile Plain"/>
      <AllowedTerrain ID="Gentle Hills"/>
      <ClimateModifier ID="Gobi Desert" Modifier="0"/>
      <ClimateModifier ID="Central Asia" Modifier="0.5"/>
    </Occurance>
    <Rewards Type="ImproveRen" Min="1" Max="2"/>
    <Cost Type="Money" Min="100" Max="300"/>
    <Text NoReward="ENC Nothing To Teach"/>
  </Encounter>

  <!-- Shaman / Witches-->
  <Encounter ID="WitchA" PersistAfterFirstVisit="10">
    <Graphics Picture="EncounterBG_08" Portrait="Character_03" SpriteMarker="G_Icon_Encounter_Default_01" EventIcon="G_Icon_List_EventEncounter_01"/>
    <Occurance BaseChance="0.0005">
      <AllowedTerrain ID="Fertile Plain"/>
      <AllowedTerrain ID="Gentle Hills"/>
      <AllowedTerrain ID="Grassland"/>
      <ClimateModifier ID="Gobi Desert" Modifier="0.1"/>
      <ClimateModifier ID="Central Asia" Modifier="0.5"/>
    </Occurance>
    <Rewards Type="IncreaseAuthority" Min="1" Max="2"/>
    <Cost Type="Money" Min="10" Max="200"/>
    <Text NoReward="ENC Only For Leader or Heir"/>
  </Encounter>

  <!-- Noble Women-->
  <Encounter ID="NoblewomanA" PersistAfterFirstVisit="10">
    <Graphics Picture="EncounterBG_11" Portrait="Character_05" SpriteMarker="G_Icon_Encounter_Default_01" EventIcon="G_Icon_List_EventEncounter_01"/>
    <Occurance BaseChance="0.0005">
      <AllowedTerrain ID="Fertile Plain"/>
      <AllowedTerrain ID="Gentle Hills"/>
      <ClimateModifier ID="Gobi Desert" Modifier="0"/>